Xpath;Nome;Definição;Tipo de Dado;Tamanho;Mandatoriedade;Formato;Domínio;Mínimo de Ocorrências;Máximo de Ocorrências;Restrições;Nulidade;Tipo de Dado Json;Exemplo;Tamanho mínimo
/data;data;;Lista;;Obrigatório;;;1;1000;"";Não permitido;array;;
/data/outageTime;outageTime;Data e hora planejada do início da indisponibilidade;Texto;;Obrigatório;^(\d{4})-(1[0-2]|0?[1-9])-(3[01]|[12][0-9]|0?[1-9])T(?:[01]\d|2[0123]):(?:[012345]\d):(?:[012345]\d)Z$;;1;1;"";Não permitido;string;2020-07-21T08:30:00Z;
/data/duration;duration;Duração prevista da indisponibilidade;Texto;;Obrigatório;^(?!\s)[\w\W\s]*[^\s]$;;1;1;"";Não permitido;string;PT2H30M;
/data/isPartial;isPartial;Flag que indica se a indisponibilidade é parcial (atingindo apenas alguns end points) ou total (atingindo todos os end points);Booleano;;Obrigatório;;;1;1;"";Não permitido;boolean;false;
/data/explanation;explanation;Explicação sobre os motivos da indisponibilidade, podendo a instituição indicar quais implementações estarão indisponíveis.;Texto;;Obrigatório;^(?!\s)[\w\W\s]*[^\s]$;;1;1;"";Não permitido;string;Atualização do API Gateway;
